[
 {
  "pi": "Luis von Ahn",
  "status": "not_pi_in_window",
  "status_evidence": [
   {
    "url": "http://www.csd.cs.cmu.edu:80/directory/faculty",
    "capture_url": "https://web.archive.org/web/20170502112003id_/http://www.csd.cs.cmu.edu:80/directory/faculty",
    "sha256": "f251a609a02aff8c24d9c5cd24203ee3663392d9ce8c0a9110c57db3aa5a8948",
    "quote": "Von Ahn Luis Consulting Professor (412) 268-2813 biglou@cs.cmu.edu"
   },
   {
    "url": "https://www.csd.cs.cmu.edu/directory/faculty",
    "capture_url": "https://web.archive.org/web/20190724065615id_/https://www.csd.cs.cmu.edu/directory/faculty",
    "sha256": "290ae169e9489f4b9008df4c83f4e0054d79ae461f525917d0ed34a94acedc52",
    "quote": "Von Ahn, Luis Consulting Professor (412) 567-6602 biglou@cs.cmu.edu"
   },
   {
    "url": "http://reports-archive.adm.cs.cmu.edu/anon/2015/abstracts/15-106.html",
    "sha256": "498aa5b726407387da4a53cbef17a7678d406dd8e043e167e19804b80acde6f1",
    "quote": "Thesis Committee: Luis von Ahn (Co-Chair) Manuel Blum (Co-Chair)"
   },
   {
    "url": "http://www.cs.cmu.edu/~biglou/",
    "sha256": "2b3fc6fc66f4c1be8a1d355e7b3c66493e5a9292755996fd02573a12cba6056d",
    "quote": "Luis von Ahn Luis von Ahn I build systems that combine humans and computers to solve large-scale problems that neither can solve alone. I call this Human Computation, but others sometimes call it Crowdsourcing. Some of my past projects include: CAPTCHA , The ESP Game (acquired by Google), GWAP , and reCAPTCHA (acquired by Google). I'm currently working on Duolingo"
   }
  ],
  "students": [],
  "identity": {
   "dblp": [
    "https://dblp.org/pid/78/391"
   ],
   "orcid": [],
   "openalex": [
    "A5104092531"
   ],
   "evidence": [
    {
     "kind": "openalex_author",
     "url": "https://api.openalex.org/authors?per-page=25&search=Luis+von+Ahn",
     "sha256": "daccf4de4f5855a9c6facbc029fbb94dce4351fe28c3c9da02cdd5d9a277da01",
     "quote": "\"display_name\": \"Luis von Ahn\"",
     "note": "Only OpenAlex author for the name (73 works); it has 0 works dated 2016 or later (works filter from_publication_date:2016-01-01 returned count 0), so no 2016+ work can be checked or attributed."
    }
   ]
  },
  "collection_person_id": "cmu_person_0702d2b90a2ff9e65616",
  "appointment_notes": [
   {
    "url": "http://www.csd.cs.cmu.edu:80/directory/faculty",
    "capture_url": "https://web.archive.org/web/20160512112516id_/http://www.csd.cs.cmu.edu:80/directory/faculty",
    "sha256": "eef847178be645a9ae8263712fdf50ec8da905de89d62fed50ee45ef62a30dd1",
    "quote": "Von Ahn Luis Associate Professor 7113 Gates & Hillman Centers (412) 268-2813 biglou@cs.cmu.edu"
   },
   {
    "url": "http://www.csd.cs.cmu.edu:80/directory/faculty",
    "capture_url": "https://web.archive.org/web/20170502112003id_/http://www.csd.cs.cmu.edu:80/directory/faculty",
    "sha256": "f251a609a02aff8c24d9c5cd24203ee3663392d9ce8c0a9110c57db3aa5a8948",
    "quote": "Von Ahn Luis Consulting Professor (412) 268-2813 biglou@cs.cmu.edu"
   }
  ],
  "notes": "Associate Professor in the May-2016 CSD directory, 'Consulting Professor' from 2017 on (Duolingo CEO). The last thesis he (co-)chaired is Brendan Meeder's CMU-CS-15-106 (2015, outside the window); no advisee found 2016-2026. OpenAlex lists no works by him after 2015, so the paper gap is genuine (there are no in-window CMU papers). DBLP pid 78/391 is from the input; dblp.org is bot-walled here so it was not re-read."
 },
 {
  "pi": "Jeremy Avigad",
  "status": "pi",
  "status_evidence": [
   {
    "url": "https://csd.cmu.edu/people/faculty/jeremy-avigad",
    "sha256": "30c70d1bae8d600b4fb801f7e15905e57ee14bcd9d64632ea4e37cdaca9df248",
    "quote": "Jeremy Avigad Jeremy Avigad Professor Department Philosophy Mathematical Sciences Research Areas Programming Languages Advisees Joshua Clune Cayden Codel Chase Norman"
   },
   {
    "url": "https://www.andrew.cmu.edu/user/avigad/students.html",
    "sha256": "442e0ce8b41e1bc7d975cf6e79da6f131c59df1496585185634bcd94c96014da",
    "quote": "Jeremy Avigad's Home Page Welcome Research Papers Books Reviews Talks Outreach Teaching Students Students I was Director of Graduate Studies in Philosophy at Carnegie Mellon from 2005 to 2009 and again from 2011 to 2012. PhD students Xinrui (Henry) Li (Computer Science, current)"
   }
  ],
  "students": [
   {
    "name": "Xinrui (Henry) Li",
    "role": "phd",
    "years": null,
    "url": "https://www.andrew.cmu.edu/user/avigad/students.html",
    "sha256": "442e0ce8b41e1bc7d975cf6e79da6f131c59df1496585185634bcd94c96014da",
    "quote": "PhD students Xinrui (Henry) Li (Computer Science, current)"
   },
   {
    "name": "Sidharth Hariharan",
    "role": "phd",
    "years": null,
    "url": "https://www.andrew.cmu.edu/user/avigad/students.html",
    "sha256": "442e0ce8b41e1bc7d975cf6e79da6f131c59df1496585185634bcd94c96014da",
    "quote": "Sidharth Hariharan (Mathematical Sciences, current)"
   },
   {
    "name": "Chase Norman",
    "role": "phd",
    "years": null,
    "url": "https://www.andrew.cmu.edu/user/avigad/students.html",
    "sha256": "442e0ce8b41e1bc7d975cf6e79da6f131c59df1496585185634bcd94c96014da",
    "quote": "Chase Norman (Computer Science, current)"
   },
   {
    "name": "Cayden Codel",
    "role": "phd",
    "years": null,
    "url": "https://www.andrew.cmu.edu/user/avigad/students.html",
    "sha256": "442e0ce8b41e1bc7d975cf6e79da6f131c59df1496585185634bcd94c96014da",
    "quote": "Cayden Codel (Computer Science, co-advised with Marijn Heule, current)"
   },
   {
    "name": "Hannah Fechtner",
    "role": "phd",
    "years": null,
    "url": "https://www.andrew.cmu.edu/user/avigad/students.html",
    "sha256": "442e0ce8b41e1bc7d975cf6e79da6f131c59df1496585185634bcd94c96014da",
    "quote": "Hannah Fechtner (Logic, Computation, and Methodology, current)"
   },
   {
    "name": "Joshua Clune",
    "role": "phd",
    "years": null,
    "url": "https://www.andrew.cmu.edu/user/avigad/students.html",
    "sha256": "442e0ce8b41e1bc7d975cf6e79da6f131c59df1496585185634bcd94c96014da",
    "quote": "Joshua Clune (Computer Science, current)"
   },
   {
    "name": "Wojciech Nawrocki",
    "role": "phd",
    "years": [
     null,
     2026
    ],
    "url": "https://www.andrew.cmu.edu/user/avigad/students.html",
    "sha256": "442e0ce8b41e1bc7d975cf6e79da6f131c59df1496585185634bcd94c96014da",
    "quote": "Wojciech Nawrocki (PhD Logic, Computation, and Methodology, May 2026)"
   },
   {
    "name": "Mario Carneiro",
    "role": "phd",
    "years": [
     null,
     2022
    ],
    "url": "https://www.andrew.cmu.edu/user/avigad/students.html",
    "sha256": "442e0ce8b41e1bc7d975cf6e79da6f131c59df1496585185634bcd94c96014da",
    "quote": "Mario Carneiro (PhD Pure and Applied Logic, August 2022)"
   },
   {
    "name": "Floris van Doorn",
    "role": "phd",
    "years": [
     null,
     2018
    ],
    "url": "https://www.andrew.cmu.edu/user/avigad/students.html",
    "sha256": "442e0ce8b41e1bc7d975cf6e79da6f131c59df1496585185634bcd94c96014da",
    "quote": "Floris van Doorn (PhD Pure and Applied Logic, May 2018)"
   },
   {
    "name": "Robert Lewis",
    "role": "phd",
    "years": [
     null,
     2018
    ],
    "url": "https://www.andrew.cmu.edu/user/avigad/students.html",
    "sha256": "442e0ce8b41e1bc7d975cf6e79da6f131c59df1496585185634bcd94c96014da",
    "quote": "Robert Lewis (PhD Pure and Applied Logic, May 2018)"
   }
  ],
  "identity": {
   "dblp": [],
   "orcid": [],
   "openalex": [],
   "evidence": []
  },
  "collection_person_id": "cmu_person_5463c6667be073c5c792",
  "appointment_notes": [
   {
    "url": "https://www.andrew.cmu.edu/user/avigad/",
    "sha256": "4d5d923c86253b4196b6043e8a28a58235c6d1723c195749d14446a0397916ac",
    "quote": "Jeremy Avigad Welcome to my home page. I am the Dean's Chair in Logic and Philosophy of Mathematics in the Department of Philosophy and the Department of Mathematical Sciences at Carnegie Mellon University"
   },
   {
    "url": "https://www.andrew.cmu.edu/user/avigad/students.html",
    "sha256": "442e0ce8b41e1bc7d975cf6e79da6f131c59df1496585185634bcd94c96014da",
    "quote": "Jeremy Avigad's Home Page Welcome Research Papers Books Reviews Talks Outreach Teaching Students Students I was Director of Graduate Studies in Philosophy at Carnegie Mellon from 2005 to 2009 and again from 2011 to 2012."
   }
  ],
  "notes": "Home department is Philosophy (with Mathematical Sciences); the CSD profile lists him with department 'Philosophy Mathematical Sciences', i.e. a courtesy CSD listing, which is why no CSD yearly listing was captured. At CMU throughout 2016-2026 (Director of Graduate Studies in Philosophy 2005-2009 and 2011-2012; current Dean's Chair). His CV (andrew.cmu.edu/user/avigad/CV.pdf, stored) puts the dates in a separate column from the titles, so no single quote carries a year range with his name."
 },
 {
  "pi": "Theophilus Benson",
  "status": "pi",
  "status_evidence": [
   {
    "url": "https://csd.cmu.edu/people/faculty/theophilus-benson",
    "sha256": "bd886f5532bac9a22bbc8931584ab98ee45e8ec9b8646cb27f4c8ae0066108de",
    "quote": "Theophilus Benson Theophilus Benson Professor Department Electrical and Computer Engineering Research Areas Systems Advisees Isabel Suizo Hamna Shafqat"
   }
  ],
  "students": [
   {
    "name": "Isabel Suizo",
    "role": "phd",
    "years": null,
    "url": "https://csd.cmu.edu/people/faculty/theophilus-benson",
    "sha256": "bd886f5532bac9a22bbc8931584ab98ee45e8ec9b8646cb27f4c8ae0066108de",
    "quote": "Theophilus Benson Theophilus Benson Professor Department Electrical and Computer Engineering Research Areas Systems Advisees Isabel Suizo"
   },
   {
    "name": "Hamna Shafqat",
    "role": "phd",
    "years": null,
    "url": "https://csd.cmu.edu/people/doctoral-student/hamna-shafqat",
    "sha256": "0e491cb8a78964fa21eefc0db38a5fb9cd13eada9718e378bb027f4d13719df6",